[
  {
    "schemaVersion": 1,
    "friendlyName": "Global header",
    "name": "header",
    "description": "Site-wide navigation header with configurable layout and localized labels.",
    "categories": [
      "global",
      "navigation"
    ],
    "tags": [
      "header",
      "menu",
      "navigation"
    ],
    "config": {
      "variant": {
        "friendlyName": "Layout",
        "description": "Choose the visual header layout.",
        "type": "select",
        "default": "standard",
        "group": "Layout properties",
        "options": [
          {
            "label": "Standard",
            "value": "standard"
          },
          {
            "label": "Centered",
            "value": "centered"
          },
          {
            "label": "Centered",
            "value": "left test"
          }
        ]
      },
      "sticky": {
        "friendlyName": "Sticky header",
        "description": "Keep the header visible while scrolling.",
        "type": "boolean",
        "default": false,
        "group": "Layout properties"
      },
      "backgroundColor": {
        "friendlyName": "Background color",
        "description": "Header background color.",
        "type": "color",
        "default": "#ffffff",
        "group": "Design"
      },
      "foregroundColor": {
        "friendlyName": "Text color",
        "description": "Header text and link color.",
        "type": "color",
        "default": "#171717",
        "group": "Design"
      },
      "showSearch": {
        "friendlyName": "Show search",
        "description": "Display the search navigation item.",
        "type": "boolean",
        "default": true,
        "group": "Features"
      }
    },
    "resources": {
      "blogLabel": {
        "value": "Blog",
        "comment": "Navigation label for the blog.",
        "group": "Navigation"
      },
      "searchLabel": {
        "value": "Search",
        "comment": "Navigation label for search.",
        "group": "Navigation"
      },
      "menuLabel": {
        "value": "Primary navigation",
        "comment": "Accessible navigation label.",
        "group": "Accessibility"
      }
    }
  }
]
